{
	"$schema": "http://json-schema.org/draft-07/schema#",
	"$id": "",
	"title": "ProductionLocation",
	"description": "A real place that is used to depict the Narrative Location or used for creating the production.",
	"type": "object",
	"required": [
		"entityType",
		"identifier"
	],
	"properties": {
		"entityInfo": {
			"title": "Entity Information",
			"$ref": "../Model/definitions.json#/properties/entityInfo"
		},
		"entityType": {
			"title": "Entity Type",
			"type": "string",
			"const": "ProductionLocation"
		},
		"identifier": {
			"$ref": "../Utility/identifier.json"
		},
		"Location": {
			"$ref": "../Utility/Location.json"
		},
		"name": {
			"title": "Production Location Name",
			"description": "A human readable name for the location",
			"type": [
				"string",
				"null"
			]
		},
		"description": {
			"title": "Production Location Description",
			"description": "A brief description of the production location",
			"type": [
				"string",
				"null"
			]
		},
		"locationType": {
			"description": "Describes whether this is production location or more specifically a shooting location",
			"enum": ["production", "shooting"],
			"default": "production"
		},
		"customData": {
			"title": "Custom Data",
			"$ref": "../Model/definitions.json#/properties/customData"
		},
		"Context": {
			"title": "Production Location Context",
			"$ref": "./Context.json"
		}
	}
}